{
  "$schema": "https://changesaga.dev/schema/v5/test-run.schema.json",
  "version": 5,
  "id": "head-36b4a21",
  "test_case": "urn:change-saga:app:test-case:trustworthy-selected-coverage",
  "test_revision": "urn:change-saga:app:test-case:trustworthy-selected-coverage:revision:r1",
  "parents": [],
  "source": {
    "repository": "https://github.com/trevordilley/change-saga.git",
    "commit": "36b4a21b5d049f272a1f4a0cbbcfdf60ded126c5"
  },
  "result": "passed",
  "summary": "The targeted referenced Go tests and Chromium security, accessibility, and pull-request review scenarios completed successfully at source commit 36b4a21b5d049f272a1f4a0cbbcfdf60ded126c5.",
  "command": "go test ./internal/areas ./internal/nextaction ./internal/cli ./internal/reviewapp ./internal/workplan ./internal/requirements ./internal/server ./internal/reviewstore -run '^(TestReportShapeIsStable|TestComparedStatusTextStatesOneCountAndListsRanges|TestCheckAnswersOnlyTheNamedAreas|TestStatusFailsOnlyWhenTheReportCannotBeTrusted|TestEveryQueryEnvelopeCarriesTheSchemaAndASnapshot|TestDocumentedReadBounds|TestSeparateRepositoriesLargeAndActiveContentAreBoundedAndInert|TestCursorsAreStableBoundAndIntegrityChecked|TestFirstChangeCoversOnlyImplementation|TestComparingPutsTheChangeBeforeTheOverview|TestActionsAreOrderedByCategoryThenAxisThenResource|TestDeterministicActionsCarryGrammarShapesAndQuestionsCarryOneQuestion|TestGrowthComesLastAndTeachesItsPractice|TestEmptyActionsAreTheFixedPoint|TestCoverBatchWritesNothingWhenAnyRecordFails|TestRequestReplayIsIdempotentAndPayloadReuseConflicts|TestWavesDoNotCreateImplicitBarriersAndDependenciesFormADAG|TestDependencyConditionsUseProgressMergeAndPinnedContractFacts|TestMovingAStoryKeepsEveryRelationCurrent|TestRevisionAndProgressGraphsRetainConcurrentHeadsUntilReconciled|TestWorkspaceAssignmentsPersistPortableIdentityAndUseParentURNs|TestEachSideListsWhatItIsAbout|TestDocumentationPagesHaveNoApprovalOrCommentControls|TestComparingShowsTheMatchingReviewBesideTheLayers|TestTheReviewSideStatesTheGapWhenThereAreNoReviews|TestRelatedReviewsAreDerivedFromTheChangedLines|TestInteractiveFragmentIsServedWithSandboxCSP|TestSecureHandlerRejectsCrossOriginFetchSiteAndHost|TestHTTPServerHasBoundedResourceSettings|TestListenRefusesNonLoopbackAddressBeforeServing|TestCleanDiagnosticPathRedactsPortableAbsolutePaths|TestMissingSagaErrorDoesNotExposeAbsoluteRoot|TestReviewItemsReferenceRecordsAndNeverCountAsCoverage|TestOnePullRequestHasOneReview|TestRepinFreezesTheLandedReviewAndHistoryLinksIt|TestReviewCoverageAccountsForItsOwnRange|TestReviewPageShowsDiffsDecisionsAndCurrency|TestReviewDecisionsGoOutOfDateSlideBySlide|TestFrozenReviewIsViewableButTakesNoDecisions|TestReviewRecordsRoundTripAndValidate|TestReviewCommentsThreadOnSlidesAndItemsOnly|TestReviewCoverageReportsTheChangesTheDeckDoesNotExplain)$' -count=1 \u0026\u0026 npm --prefix e2e test -- tests/security.spec.ts tests/accessibility.spec.ts tests/pull-request-review.spec.ts",
  "evidence": [
    "urn:change-saga:app:test-case:trustworthy-selected-coverage:evidence:test-implementation",
    "urn:change-saga:app:test-case:trustworthy-selected-coverage:evidence:implementation-under-test"
  ],
  "executed_at": "2026-09-21T05:56:26Z",
  "request_id": "quality-run-trustworthy-selected-coverage-36b4a21"
}
